{
  "diagnostics": [
    "No reproducible finite-model producer exists on main; no law result is asserted."
  ],
  "schema": "kofun.law-evidence/v1",
  "source": {
    "path": "examples/proven_optional_bool_monad.kofun",
    "sha256": "2e9da000501d9b99fbbfd4cfea3aa483f1d7db68e14a6be8f7c012f87194739a"
  },
  "status": "unverified"
}
